{
  "$id": "EXECUTION_ENV_FINGERPRINT/v0.1",
  "$schema": "https://json-schema.org/draft/2020-12/schema",
  "additionalProperties": false,
  "properties": {
    "coverage": {
      "additionalProperties": false,
      "properties": {
        "inherited_env_names": {
          "items": {
            "minLength": 1,
            "type": "string"
          },
          "type": "array",
          "uniqueItems": true
        },
        "native_runtime_names": {
          "items": {
            "minLength": 1,
            "type": "string"
          },
          "type": "array",
          "uniqueItems": true
        },
        "required_observations": {
          "items": {
            "enum": [
              "api_set_schema",
              "architecture",
              "engine_companion",
              "inherited_environment",
              "native_runtime_manifest",
              "os_build",
              "os_family",
              "python",
              "ucrt_candidate",
              "vc_runtime_candidate"
            ]
          },
          "type": "array",
          "uniqueItems": true
        },
        "scope_id": {
          "minLength": 1,
          "type": "string"
        },
        "verification_mode": {
          "const": "CALLER_PREVERIFIED_OBSERVED_CANDIDATES"
        }
      },
      "required": [
        "scope_id",
        "required_observations",
        "native_runtime_names",
        "inherited_env_names",
        "verification_mode"
      ],
      "type": "object"
    },
    "domain": {
      "const": "EXECUTION_ENV_FINGERPRINT/v0.1"
    },
    "observations": {
      "additionalProperties": false,
      "properties": {
        "api_set_schema": {
          "additionalProperties": false,
          "properties": {
            "state": {
              "enum": [
                "KNOWN",
                "MISSING",
                "STALE",
                "UNTRUSTED",
                "UNKNOWN"
              ]
            },
            "value": {
              "anyOf": [
                {
                  "additionalProperties": false,
                  "properties": {
                    "sha256": {
                      "pattern": "^[0-9a-f]{64}$",
                      "type": [
                        "string",
                        "null"
                      ]
                    }
                  },
                  "required": [
                    "sha256"
                  ],
                  "type": "object"
                },
                {
                  "type": "null"
                }
              ]
            }
          },
          "required": [
            "state",
            "value"
          ],
          "type": "object"
        },
        "architecture": {
          "additionalProperties": false,
          "properties": {
            "state": {
              "enum": [
                "KNOWN",
                "MISSING",
                "STALE",
                "UNTRUSTED",
                "UNKNOWN"
              ]
            },
            "value": {
              "anyOf": [
                {
                  "minLength": 1,
                  "type": "string"
                },
                {
                  "type": "null"
                }
              ]
            }
          },
          "required": [
            "state",
            "value"
          ],
          "type": "object"
        },
        "engine_companion": {
          "additionalProperties": false,
          "properties": {
            "state": {
              "enum": [
                "KNOWN",
                "MISSING",
                "STALE",
                "UNTRUSTED",
                "UNKNOWN"
              ]
            },
            "value": {
              "anyOf": [
                {
                  "additionalProperties": false,
                  "properties": {
                    "sha256": {
                      "pattern": "^[0-9a-f]{64}$",
                      "type": [
                        "string",
                        "null"
                      ]
                    }
                  },
                  "required": [
                    "sha256"
                  ],
                  "type": "object"
                },
                {
                  "type": "null"
                }
              ]
            }
          },
          "required": [
            "state",
            "value"
          ],
          "type": "object"
        },
        "inherited_environment": {
          "additionalProperties": false,
          "properties": {
            "state": {
              "enum": [
                "KNOWN",
                "MISSING",
                "STALE",
                "UNTRUSTED",
                "UNKNOWN"
              ]
            },
            "value": {
              "anyOf": [
                {
                  "additionalProperties": false,
                  "properties": {
                    "entries": {
                      "items": {
                        "additionalProperties": false,
                        "allOf": [
                          {
                            "if": {
                              "properties": {
                                "state": {
                                  "enum": [
                                    "unset",
                                    "empty"
                                  ]
                                }
                              }
                            },
                            "then": {
                              "properties": {
                                "value_identity": {
                                  "type": "null"
                                }
                              }
                            }
                          }
                        ],
                        "properties": {
                          "classification": {
                            "minLength": 1,
                            "type": "string"
                          },
                          "name": {
                            "minLength": 1,
                            "type": "string"
                          },
                          "state": {
                            "enum": [
                              "unset",
                              "empty",
                              "present"
                            ]
                          },
                          "value_identity": {
                            "pattern": "^[0-9a-f]{64}$",
                            "type": [
                              "string",
                              "null"
                            ]
                          }
                        },
                        "required": [
                          "name",
                          "state",
                          "value_identity",
                          "classification"
                        ],
                        "type": "object"
                      },
                      "type": "array"
                    },
                    "policy_version": {
                      "minLength": 1,
                      "type": "string"
                    }
                  },
                  "required": [
                    "policy_version",
                    "entries"
                  ],
                  "type": "object"
                },
                {
                  "type": "null"
                }
              ]
            }
          },
          "required": [
            "state",
            "value"
          ],
          "type": "object"
        },
        "native_runtime_manifest": {
          "additionalProperties": false,
          "properties": {
            "state": {
              "enum": [
                "KNOWN",
                "MISSING",
                "STALE",
                "UNTRUSTED",
                "UNKNOWN"
              ]
            },
            "value": {
              "anyOf": [
                {
                  "additionalProperties": false,
                  "properties": {
                    "entries": {
                      "items": {
                        "additionalProperties": false,
                        "properties": {
                          "logical_name": {
                            "minLength": 1,
                            "type": "string"
                          },
                          "role": {
                            "minLength": 1,
                            "type": "string"
                          },
                          "sha256": {
                            "pattern": "^[0-9a-f]{64}$",
                            "type": [
                              "string",
                              "null"
                            ]
                          },
                          "size": {
                            "minimum": 0,
                            "type": "integer"
                          }
                        },
                        "required": [
                          "logical_name",
                          "sha256",
                          "size",
                          "role"
                        ],
                        "type": "object"
                      },
                      "type": "array"
                    },
                    "identity_kind": {
                      "const": "OBSERVED_CANDIDATES_NOT_LOADED"
                    }
                  },
                  "required": [
                    "identity_kind",
                    "entries"
                  ],
                  "type": "object"
                },
                {
                  "type": "null"
                }
              ]
            }
          },
          "required": [
            "state",
            "value"
          ],
          "type": "object"
        },
        "os_build": {
          "additionalProperties": false,
          "properties": {
            "state": {
              "enum": [
                "KNOWN",
                "MISSING",
                "STALE",
                "UNTRUSTED",
                "UNKNOWN"
              ]
            },
            "value": {
              "anyOf": [
                {
                  "minLength": 1,
                  "type": "string"
                },
                {
                  "type": "null"
                }
              ]
            }
          },
          "required": [
            "state",
            "value"
          ],
          "type": "object"
        },
        "os_family": {
          "additionalProperties": false,
          "properties": {
            "state": {
              "enum": [
                "KNOWN",
                "MISSING",
                "STALE",
                "UNTRUSTED",
                "UNKNOWN"
              ]
            },
            "value": {
              "anyOf": [
                {
                  "minLength": 1,
                  "type": "string"
                },
                {
                  "type": "null"
                }
              ]
            }
          },
          "required": [
            "state",
            "value"
          ],
          "type": "object"
        },
        "python": {
          "additionalProperties": false,
          "properties": {
            "state": {
              "enum": [
                "KNOWN",
                "MISSING",
                "STALE",
                "UNTRUSTED",
                "UNKNOWN"
              ]
            },
            "value": {
              "anyOf": [
                {
                  "additionalProperties": false,
                  "properties": {
                    "distribution": {
                      "additionalProperties": false,
                      "properties": {
                        "fingerprint_sha256": {
                          "pattern": "^[0-9a-f]{64}$",
                          "type": [
                            "string",
                            "null"
                          ]
                        },
                        "policy_id": {
                          "minLength": 1,
                          "type": [
                            "string",
                            "null"
                          ]
                        },
                        "policy_sha256": {
                          "pattern": "^[0-9a-f]{64}$",
                          "type": [
                            "string",
                            "null"
                          ]
                        },
                        "policy_version": {
                          "minLength": 1,
                          "type": [
                            "string",
                            "null"
                          ]
                        }
                      },
                      "required": [
                        "fingerprint_sha256",
                        "policy_id",
                        "policy_version",
                        "policy_sha256"
                      ],
                      "type": "object"
                    },
                    "executable_sha256": {
                      "pattern": "^[0-9a-f]{64}$",
                      "type": [
                        "string",
                        "null"
                      ]
                    },
                    "implementation": {
                      "minLength": 1,
                      "type": [
                        "string",
                        "null"
                      ]
                    },
                    "version": {
                      "minLength": 1,
                      "type": [
                        "string",
                        "null"
                      ]
                    }
                  },
                  "required": [
                    "executable_sha256",
                    "version",
                    "implementation",
                    "distribution"
                  ],
                  "type": "object"
                },
                {
                  "type": "null"
                }
              ]
            }
          },
          "required": [
            "state",
            "value"
          ],
          "type": "object"
        },
        "ucrt_candidate": {
          "additionalProperties": false,
          "properties": {
            "state": {
              "enum": [
                "KNOWN",
                "MISSING",
                "STALE",
                "UNTRUSTED",
                "UNKNOWN"
              ]
            },
            "value": {
              "anyOf": [
                {
                  "additionalProperties": false,
                  "properties": {
                    "identity_kind": {
                      "const": "OBSERVED_CANDIDATE_FINGERPRINT"
                    },
                    "sha256": {
                      "pattern": "^[0-9a-f]{64}$",
                      "type": [
                        "string",
                        "null"
                      ]
                    }
                  },
                  "required": [
                    "identity_kind",
                    "sha256"
                  ],
                  "type": "object"
                },
                {
                  "type": "null"
                }
              ]
            }
          },
          "required": [
            "state",
            "value"
          ],
          "type": "object"
        },
        "vc_runtime_candidate": {
          "additionalProperties": false,
          "properties": {
            "state": {
              "enum": [
                "KNOWN",
                "MISSING",
                "STALE",
                "UNTRUSTED",
                "UNKNOWN"
              ]
            },
            "value": {
              "anyOf": [
                {
                  "additionalProperties": false,
                  "properties": {
                    "identity_kind": {
                      "const": "OBSERVED_CANDIDATE_FINGERPRINT"
                    },
                    "sha256": {
                      "pattern": "^[0-9a-f]{64}$",
                      "type": [
                        "string",
                        "null"
                      ]
                    }
                  },
                  "required": [
                    "identity_kind",
                    "sha256"
                  ],
                  "type": "object"
                },
                {
                  "type": "null"
                }
              ]
            }
          },
          "required": [
            "state",
            "value"
          ],
          "type": "object"
        }
      },
      "required": [],
      "type": "object"
    },
    "policy": {
      "additionalProperties": false,
      "properties": {
        "domain": {
          "const": "EXECUTION_ENV_COMPATIBILITY_POLICY/v0.1"
        },
        "policy_id": {
          "minLength": 1,
          "type": "string"
        },
        "sha256": {
          "pattern": "^[0-9a-f]{64}$",
          "type": "string"
        },
        "version": {
          "minLength": 1,
          "type": "string"
        }
      },
      "required": [
        "domain",
        "policy_id",
        "version",
        "sha256"
      ],
      "type": "object"
    },
    "provenance": {
      "additionalProperties": false,
      "properties": {
        "collected_at": {
          "minLength": 1,
          "type": "string"
        },
        "collector_run_id": {
          "minLength": 1,
          "type": "string"
        },
        "evidence_pointer": {
          "minLength": 1,
          "type": "string"
        },
        "file_path": {
          "minLength": 1,
          "type": "string"
        },
        "hostname": {
          "minLength": 1,
          "type": "string"
        },
        "human_note": {
          "minLength": 1,
          "type": "string"
        },
        "pid": {
          "minimum": 0,
          "type": "integer"
        },
        "trace_sha256": {
          "pattern": "^[0-9a-f]{64}$",
          "type": "string"
        }
      },
      "required": [],
      "type": "object"
    },
    "schema_version": {
      "const": "0.1"
    }
  },
  "required": [
    "schema_version",
    "domain",
    "policy",
    "coverage",
    "observations",
    "provenance"
  ],
  "type": "object"
}
