{
  "schema_version": "0.1",
  "domain": "EXECUTION_ENV_FINGERPRINT/v0.1",
  "policy": {
    "domain": "EXECUTION_ENV_COMPATIBILITY_POLICY/v0.1",
    "policy_id": "WINDOWS_A1_FINITE_B_DEFAULT/v0.1",
    "version": "0.1",
    "sha256": "f1b1e98e4d74582921da2c8bc1981ec9b46c784fd82cb08d96ea30395b6660e4"
  },
  "coverage": {
    "inherited_env_names": [
      "LANG",
      "LC_ALL",
      "PATH",
      "TEMP",
      "TMP",
      "TZ"
    ],
    "native_runtime_names": [
      "ucrtbase.dll",
      "vcruntime140.dll"
    ],
    "required_observations": [
      "api_set_schema",
      "architecture",
      "engine_companion",
      "inherited_environment",
      "native_runtime_manifest",
      "os_build",
      "os_family",
      "python",
      "ucrt_candidate",
      "vc_runtime_candidate"
    ],
    "scope_id": "WINDOWS_A1_FINITE_B/v0.1",
    "verification_mode": "CALLER_PREVERIFIED_OBSERVED_CANDIDATES"
  },
  "observations": {
    "os_family": {
      "state": "KNOWN",
      "value": "Windows"
    },
    "os_build": {
      "state": "KNOWN",
      "value": "10.0.26200"
    },
    "architecture": {
      "state": "KNOWN",
      "value": "AMD64"
    },
    "engine_companion": {
      "state": "KNOWN",
      "value": {
        "sha256": "b480fae45d6e6337bb531f74b8e90b4f4470bef623e1a33e81c03c43f621e768"
      }
    },
    "api_set_schema": {
      "state": "KNOWN",
      "value": {
        "sha256": "391a2818fdef14f4a9b6e6ce2a7e7f01d04f943de9ef543ec683927cfe480889"
      }
    },
    "native_runtime_manifest": {
      "state": "KNOWN",
      "value": {
        "identity_kind": "OBSERVED_CANDIDATES_NOT_LOADED",
        "entries": [
          {
            "logical_name": "ucrtbase.dll",
            "sha256": "5c52e3a303baaac0e0af8bd9b96134993da34bc9d834a31ef37e1d2cdc7fe192",
            "size": 1377512,
            "role": "runtime_candidate"
          },
          {
            "logical_name": "vcruntime140.dll",
            "sha256": "184146852727a9db4eea06178716bec3cdbb1015c911f6b0f915b184ad7775b2",
            "size": 123472,
            "role": "runtime_candidate"
          }
        ]
      }
    },
    "vc_runtime_candidate": {
      "state": "KNOWN",
      "value": {
        "identity_kind": "OBSERVED_CANDIDATE_FINGERPRINT",
        "sha256": "184146852727a9db4eea06178716bec3cdbb1015c911f6b0f915b184ad7775b2"
      }
    },
    "ucrt_candidate": {
      "state": "KNOWN",
      "value": {
        "identity_kind": "OBSERVED_CANDIDATE_FINGERPRINT",
        "sha256": "5c52e3a303baaac0e0af8bd9b96134993da34bc9d834a31ef37e1d2cdc7fe192"
      }
    },
    "python": {
      "state": "UNTRUSTED",
      "value": {
        "executable_sha256": null,
        "version": null,
        "implementation": null,
        "distribution": {
          "fingerprint_sha256": "0462d84099529c18f09c467f90272a9772227cd14d6d5dddbcb61e0a388de43d",
          "policy_id": "WINDOWS_A1_STDLIB_ONLY/v0.1",
          "policy_version": "0.1",
          "policy_sha256": "9707b2ed4ba1e4cac3919b7ecb752f5702cb289105c1c7c8373799616734c0c4"
        }
      }
    },
    "inherited_environment": {
      "state": "UNTRUSTED",
      "value": {
        "policy_version": "0.1",
        "entries": [
          {
            "name": "LANG",
            "state": "present",
            "value_identity": "99fed2d548c2eb1022f4067f97fe838a2c3ea60ee0e0f53086788505c3ababad",
            "classification": "HASHED_NONSECRET"
          },
          {
            "name": "LC_ALL",
            "state": "present",
            "value_identity": "99fed2d548c2eb1022f4067f97fe838a2c3ea60ee0e0f53086788505c3ababad",
            "classification": "HASHED_NONSECRET"
          },
          {
            "name": "PATH",
            "state": "present",
            "value_identity": "535a85342618004cbd5c33ed00c74b740d594dbd340acff151fa25a2483a27b7",
            "classification": "HASHED_NONSECRET"
          },
          {
            "name": "TEMP",
            "state": "present",
            "value_identity": "1999365223dc2e5a6fb019157a1a1260cca8a3d94f721df68fde7bda58fe4836",
            "classification": "HASHED_NONSECRET"
          },
          {
            "name": "TMP",
            "state": "present",
            "value_identity": "1999365223dc2e5a6fb019157a1a1260cca8a3d94f721df68fde7bda58fe4836",
            "classification": "HASHED_NONSECRET"
          },
          {
            "name": "TZ",
            "state": "unset",
            "value_identity": null,
            "classification": "HASHED_NONSECRET"
          }
        ]
      }
    }
  },
  "provenance": {
    "collected_at": "2026-10-06T07:25:08.161408+00:00",
    "collector_run_id": "0b4e1f57-7b16-4e7a-8d8d-e087350257c6",
    "human_note": "Collection-time B baseline only; no historical execution backfill or loaded-module claim"
  }
}
